{"contract_version":"cwl_cefr_language_assessment/result_snapshot/v1","result_reference":"cefr_result_0001","participant_reference":"participant_opaque_0001","assessment_session_reference":"assessment_session_0001","instrument_release_reference":"instrument_release_en_placement_v1","assessment_blueprint_reference":"cefr_en_placement_a1_b2_blueprint_v1","scoring_profile_reference":"scoring_profile_en_placement_v1","cut_score_revision_reference":"cut_score_revision_en_placement_v1","target_language":"en","claim_status_code":"cefr_aligned","domain_results":[{"domain_code":"reading_reception","measurement_status_code":"measured","reported_level_code":"b2","level_probabilities":{"b1":0.18,"b2":0.76,"c1":0.06},"credible_level_set":["b1","b2"],"standard_error":0.29,"descriptor_coverage_references":["coverage_reading_0001"]},{"domain_code":"listening_reception","measurement_status_code":"measured","reported_level_code":"b1","level_probabilities":{"a2":0.16,"b1":0.69,"b2":0.15},"credible_level_set":["a2","b1","b2"],"standard_error":0.34,"descriptor_coverage_references":["coverage_listening_0001"]},{"domain_code":"written_production","measurement_status_code":"measured","reported_level_code":"b2","level_probabilities":{"b1":0.22,"b2":0.71,"c1":0.07},"credible_level_set":["b1","b2"],"standard_error":0.31,"descriptor_coverage_references":["coverage_writing_0001"]},{"domain_code":"spoken_production","measurement_status_code":"insufficient_evidence","limitation_codes":["audio_evidence_below_minimum_duration"]}],"overall_result":{"reporting_status_code":"not_reported","required_domain_completeness_code":"incomplete","reason_code":"required_domain_insufficient_evidence"},"human_review_status_code":"required","result_evidence_references":["response_snapshot_0001","scoring_run_0001","rater_observation_bundle_0001"],"measurement_limitation_codes":["spoken_production_not_scoreable"],"observed_at":"2026-08-27T09:45:00Z","published_at":"2026-08-27T10:00:00Z","result_digest":"sha256:2222222222222222222222222222222222222222222222222222222222222222"}
